{"artifacts":{"changelog":"project/CHANGELOG.md","release_docs":["docs/release/release-checklist-0.82.0.md","docs/release/feature-flags-0.82.0.md","docs/release/rollback-plan-0.82.0.md"],"review_evidence":[".governance/evidence-log.md"]},"effective_state":{"amendments":[],"lifecycle_state":"released","withdrawn":false},"events":[{"claims":{"derivation":"manifest_only_transition","m4_authorization":"DEC-197_standard_chain_fullchain_20260918","release_task":"REL-078"},"id":"rel078-transition","integrity":"sha256:34d779ab29518d6333f3eadb1e9cb18aa1ef6cf8f05e8a897927a2a899be9a5e","recorded_at":"2026-09-18T00:00:00Z","type":"candidate_to_released"}],"lifecycle_state":"released","provenance":"native","schema_version":1,"trust":{"candidate_commit":{"derivation":"git_commit_adding_path"}},"version":"0.82.0"}
