{"artifacts":{"changelog":"project/CHANGELOG.md","release_docs":["docs/release/release-checklist-0.78.1.md","docs/release/feature-flags-0.78.1.md","docs/release/rollback-plan-0.78.1.md"],"review_evidence":[".governance/evidence-log.md"]},"effective_state":{"amendments":[],"lifecycle_state":"candidate","withdrawn":false},"events":[],"lifecycle_state":"candidate","provenance":"native","schema_version":1,"trust":{"candidate_commit":{"derivation":"git_commit_adding_path"}},"version":"0.78.1"}
