{"schema_version":1,"version":"0.65.0","lifecycle_state":"released","provenance":"historical_backfill","artifacts":{"changelog":"project/CHANGELOG.md","release_docs":["docs/release/release-checklist-0.65.0.md","docs/release/feature-flags-0.65.0.md","docs/release/rollback-plan-0.65.0.md"],"review_evidence":[".governance/evidence-log.md"]},"trust":{"original_release_commit":"0ac878e203f2323b7b0705cd28839f81448dfadf","backfill_commit":{"derivation":"git_commit_adding_path"},"document_contemporaneity":"contemporaneous","tag_disposition":"created_by_decision","tag_decision":"DEC-136"},"events":[],"effective_state":{"lifecycle_state":"released","withdrawn":false,"amendments":[]}}
