{"schema_version":1,"version":"0.65.1","lifecycle_state":"released","provenance":"historical_backfill","artifacts":{"changelog":"project/CHANGELOG.md","release_docs":["docs/release/release-checklist-0.65.1.md","docs/release/feature-flags-0.65.1.md","docs/release/rollback-plan-0.65.1.md"],"review_evidence":[".governance/evidence-log.md"]},"trust":{"original_release_commit":"fe6403767c3bae3f78d256a7cbdf44b20b8bb273","backfill_commit":{"derivation":"git_commit_adding_path"},"document_contemporaneity":"contemporaneous","tag_disposition":"verified_present","tag_decision":null},"events":[],"effective_state":{"lifecycle_state":"released","withdrawn":false,"amendments":[]}}
