{"lifecycle_state":"released","effective_state":{"amendments":[],"withdrawn":false,"lifecycle_state":"released"},"provenance":"native","events":[{"type":"candidate_to_released","integrity":"sha256:0e189ac4604a02f103105139aebc7cf060dcd1f8b861689a55628a51d1d2c6c7","id":"rel097-transition","recorded_at":"2026-10-01T14:44:13Z","claims":{"derivation":"manifest_only_transition","m4_authorization":"user_M7_GO_ruling_20261001_NOGO_zeroing_then_disclosure_acceptance_plus_arch_conditional_Go_D7","release_task":"REL-097"}}],"schema_version":1,"version":"0.93.1","artifacts":{"release_docs":["docs/release/feature-flags-0.93.1.md","docs/release/release-checklist-0.93.1.md","docs/release/rollback-plan-0.93.1.md","docs/reconciliation-0.93.1.md"],"changelog":"project/CHANGELOG.md","review_evidence":[".governance/evidence-log.md"]},"trust":{"candidate_commit":{"derivation":"git_commit_adding_path"}}}
