{"artifacts":{"changelog":"project/CHANGELOG.md","release_docs":["docs/release/feature-flags-0.94.0.md","docs/release/release-checklist-0.94.0.md","docs/release/rollback-plan-0.94.0.md","docs/reconciliation-0.94.0.md"],"review_evidence":[".governance/evidence-log.md"]},"effective_state":{"amendments":[],"lifecycle_state":"released","withdrawn":false},"events":[{"claims":{"derivation":"manifest_only_transition","m4_authorization":"user_M7_gate_ruling_20261003_NOGO_repair_first_then_resume_Go_via_scope_A_plus_two_small_tickets","release_task":"REL-098"},"id":"rel098-transition","integrity":"sha256:2f6f985d602750c297a79c98610fabf77d0d8279544106eca948683679d1c759","recorded_at":"2026-10-04T01:15:14Z","type":"candidate_to_released"}],"lifecycle_state":"released","provenance":"native","schema_version":1,"trust":{"candidate_commit":{"derivation":"git_commit_adding_path"}},"version":"0.94.0"}
