{"artifacts":{"changelog":"project/CHANGELOG.md","release_docs":["docs/release/feature-flags-0.91.0.md","docs/release/release-checklist-0.91.0.md","docs/release/release-plan-0.91.0.md","docs/release/rollback-plan-0.91.0.md"],"review_evidence":[".governance/evidence-log.md"]},"effective_state":{"amendments":[],"lifecycle_state":"released","withdrawn":false},"events":[{"claims":{"derivation":"manifest_only_transition","m4_authorization":"DEC-265_preauthorization_plus_DEC-267_conditional_go_20260928","release_task":"REL-094"},"id":"rel094-transition","integrity":"sha256:70e09dd9e7b7813c10ec7acf8f2ea3418ad092565ca8abbda676a5911b4e8c0d","recorded_at":"2026-09-27T21:12:18Z","type":"candidate_to_released"}],"lifecycle_state":"released","provenance":"native","schema_version":1,"trust":{"candidate_commit":{"derivation":"git_commit_adding_path"}},"version":"0.91.0"}
