{"artifacts":{"changelog":"project/CHANGELOG.md","release_docs":["docs/release/feature-flags-0.99.0.md","docs/release/release-checklist-0.99.0.md","docs/release/rollback-plan-0.99.0.md","docs/release/version-plan-0.99.0.md"],"review_evidence":[".governance/evidence-log.md"]},"effective_state":{"amendments":[],"lifecycle_state":"released","withdrawn":false},"events":[{"claims":{"derivation":"manifest_only_transition","disclosure":"discipline_chain_EVD_2138_2143_2144_2146_2147; hook_bypass_EVD_2145_recurrence_2149; manifest_history_rewrite_manifest_only_commits_tag_unchanged","m4_authorization":"user_ask_20261024_go_approved_DEC368_four_rulings","release_task":"REL-103"},"id":"rel103-transition","integrity":"sha256:b69e416fd93d3d6eb2fa67efc64ae0aa698075c36a1545adf295924cf0a4a33d","recorded_at":"2026-10-24T05:40:00Z","type":"candidate_to_released"}],"lifecycle_state":"released","provenance":"native","schema_version":1,"trust":{"candidate_commit":{"derivation":"git_commit_adding_path"}},"version":"0.99.0"}
