{"artifacts":{"changelog":"project/CHANGELOG.md","release_docs":["docs/release/feature-flags-0.98.0.md","docs/release/release-checklist-0.98.0.md","docs/release/rollback-plan-0.98.0.md","docs/release/m-0-assembly-0.98.0.md"],"review_evidence":[".governance/evidence-log.md"]},"effective_state":{"amendments":[],"lifecycle_state":"released","withdrawn":false},"events":[{"claims":{"derivation":"manifest_only_transition","m4_authorization":"user_ask_20261015_rel102_full_sequence_M5b_to_M8_authorized_dual_review_AWN0_GO_terminal_DEC358","release_task":"REL-102"},"id":"rel102-transition","integrity":"sha256:a8ebc41e1bcac2d9958c2ba5badac36b839c8da6f6881b97b5d0155fb1bbbab3","recorded_at":"2026-10-16T01:08:55Z","type":"candidate_to_released"}],"lifecycle_state":"released","provenance":"native","schema_version":1,"trust":{"candidate_commit":{"derivation":"git_commit_adding_path"}},"version":"0.98.0"}
